Author,Comment,Likes,Published At,Comment ID
@Foxcrusher,Me watching this 3 years after Covid started Well its definitely a fast pandemic but still going on after many years! Still new variants and spikes and happening randomly! Lol,7,2022-04-12T16:53:25Z,UgzcVW__JE4Kn_T3rmx4AaABAg
@Pyrodiac,"If you just hit the Sort By Newest First button, welcome to the second most degenerate comment section ever!",10,2022-04-12T03:19:04Z,UgxdztT-7V2jWWipLbZ4AaABAg
@MethosOhio,A slow pandemic will not be remembered by the history books,14,2022-04-11T16:46:38Z,UgwFaBPPojRfjiIYKKp4AaABAg
@thefirephoenix872,"People these days, not getting vaccines for anything, what idiots, what our ancestors hundreds of year ago even when we were still evolving into humans would have done for a vaccine",7,2022-04-05T06:45:33Z,UgwfEvzP8CfZyL8B5vF4AaABAg
@ericlindsay9458,I had covid and I respect the restrictions and I still wear a mask and Social distance my family and friends respect it,9,2022-04-03T19:19:05Z,UgwIUJEShFYLGWTxFAV4AaABAg
@hamstermunchies5558,"Its interesting how much the symptoms vary. For me I had bad thirst, feeling like there is water in my ears and very severe body pain, especially in my back. If it wasnt for a positive test I wouldnt of thought I had covid at all",450,2022-03-30T17:34:21Z,Ugx3l3AmPhC8wiXmZGR4AaABAg
@MrChimi-tz9cj,"I dont know why but nearly after 3 years and the people treating the virus like its non existent, I am finally watching a video on what coronavirus is.",9,2022-03-26T05:10:40Z,Ugw5qK5PRajmXGscjqR4AaABAg
@matthewspawn5916,This makes Covid seem really dangerous but in reality this just described every single virus ever.,6,2022-03-25T22:01:17Z,Ugwd6Quu0UUtrP1FYod4AaABAg
@maglev957,It really speaks to the power of this video and the ignorance of mass media that literally two years later this is still very useful advice,66,2022-03-24T04:04:56Z,Ugz7xamufSDcN0UrZ9l4AaABAg
@moonlit_maestro,Its kinda sad that nobody cared.,12,2022-03-22T22:58:58Z,Ugz63CY9aZmYbITTaIF4AaABAg
@Dawid23_Gamer,"If you can, stay at home",9,2022-03-07T22:49:36Z,UgwGmpp9meBf_jZM9wR4AaABAg
@9a_23_tyrantqiu7,"a fast pandemic will be deadly and remembered, while a slow pandemic will not",12,2022-03-07T05:23:09Z,Ugwy_ailRMj5t17QINR4AaABAg
@BrightBluePaint,I love how it is 2022 and this is still helpful.,15,2022-02-20T03:05:15Z,UgwP-5mZQ5EiJnHFMuR4AaABAg
@grahammewburn,Many countries have reduced Covid restrictions. 7 countries have dropped all Covid restrictions.,7,2022-02-15T20:33:51Z,Ugzy6XDSchYK1BY0uxF4AaABAg
@JackNuich,"if only it was a slow pandemic, but no, its lasting and fast. its been 2 whole years since the original international outbreak and all hell broke loose within those two years, and with covid evolving, lets hope we can to",70,2022-02-12T10:26:55Z,UgyTSoMP8pchvM1XlLl4AaABAg
@kevin4gwen,Why cant people just get the corona vaccine? why are people protesting against getting the corona vaccine?,12,2022-02-11T02:29:55Z,Ugz_rWmMY0JlIpWA7454AaABAg
@JordiVanderwaal,Kurzgesagt We can either have a fast pandemic or a slow pandemic.,7,2022-02-08T03:31:44Z,UgyHC7PYZezJLGor0nN4AaABAg
@eupd1osa,This isnt education this is lies and corruption. Its just a normal virus. Vaccines are not necessary they havent even been tested to be confirmed safe.,6,2022-02-07T12:21:56Z,UgwTgF-qPubyOg4ZfoB4AaABAg
@sambhav7138,This video precisely predicted the consequences of second wave of covid  19 in India a year before it. Kudos!,6,2022-02-05T19:31:17Z,UgzUlCNY7AdMUNpXuid4AaABAg
@giovanniscg8540,What you should do,7,2022-02-05T00:25:05Z,Ugx8s8lqdpxc9pE6cMF4AaABAg
@mjinnocent7494,"this is a meaningful video,it does tell us how covid 19 infected us and how to protect ourselves also what can we do, thank you so much for making this video ",7,2022-02-04T08:32:26Z,UgyVAXZ_t21D64jQN_F4AaABAg
@lordlem,"Would love to see a new video about everything happening today. How viruses get variants, how variants can spread, and the dangers of using only vaccines to combat a pandemic as a sort of silver bullet strategy.",19,2022-02-03T06:50:08Z,UgynSx75Z4-0VMZfq654AaABAg
@gildedthrone6128,Infinetly better than how the general media explained it.,493,2022-02-01T22:45:38Z,Ugz7_itTfgDlMGgHX-54AaABAg
@rei_cirith,"Its so simple... 2 years later, it feels like such a gut punch that so many people just dont seem to understand any of it on a basic level.",24,2022-01-31T16:00:05Z,UgwZhlGkONVGw7ElQmR4AaABAg
@jeongyeonstolejiminsjams,im sitting here.. almost 2 years later watching this video. i remember thinking about how this was only gonna be around for a couple weeks.. two years later and ive caught the virus,7,2022-01-29T11:18:45Z,UgxLvE5D9m51VZz1EYh4AaABAg
@TooQueenForThis,"Imagine putting lots of effort into researching something so the unknown public can be informed safely and as best as you could, only to be yelled at by idiots who dont know a thing or two of what theyre saying.",11,2022-01-26T04:31:37Z,Ugzz4KvvxmDfcCxf4m94AaABAg
@mikaeloverfjord9047,"I am so happy to announce that my grandparents just survived corona, thankfully they had already gotten their vaccinations, so they were some what prepared.",21,2022-01-23T22:16:33Z,UgyReN89TWVWbVyPIV14AaABAg
@Skyrem25,"This is so well done and illustrated even so the kids can get the idea but its been 2 years since then and our countries keep messing with us every couple of months a new root, a new name, new restrictions its getting worse and worse ppl cant have it anymore..",8,2022-01-20T23:11:24Z,Ugw9zMwNEHdYovE7aF54AaABAg
@dieguitofmb,the amazingness of this channel turning very difficult themes to very understandable messages is perfect,14,2022-01-17T23:16:45Z,Ugz4IFy2uVxtqIFhZU54AaABAg
@daysmae2145,I Work in the nursing field and every nurse in my section is currently covid positive so yes we are short staffed in the nursing field currently i have it currently and feel SOB Chest pains and cough stuffy nose,13,2022-01-11T04:18:08Z,UgyKN2UF-xESGvfL-Ht4AaABAg
@ras-qp4xx,"If you want to see all the stupid antivaxxers, COVID deniers, and people who even believe viruses are not real, then just sort the comments by Newest first, grab some popcorn, and enjoy ",7,2022-01-07T07:27:05Z,UgxkF1wR1DpBmKj9YVh4AaABAg
@youngsixty7395,Whos watching in 2022?,6,2022-01-02T17:47:00Z,Ugwpa6Co7jj5TGeydZx4AaABAg
@TheDrazorx,"Please do a video explaining how the testing works. What genetic code was used, how to genetic code was sampled, and where the genetic code was sourced from in order to find out if we are infected ",90,2021-12-27T15:19:50Z,UgwNfTlpPq5pzXtpegt4AaABAg
@davecawood9853,"I have had both jabs and my booster, caught covid, now on day 8, symptoms slight headache, lots of sneezing, slight cough, normally in the morning, really pleased I have had all my jabs, my advice to anybody is get the jabs in your arms , think I would of been really bad had I not got my jabs",8,2021-12-22T18:11:56Z,UgzpZO-rhG8MbAJg3Sx4AaABAg
@FluxSonic,"Would love to see a new video about everything happening today. How viruses get variants, how variants can spread, and the dangers of using only vaccines to combat a pandemic as a sort of silver bullet strategy.",2018,2021-12-22T08:53:24Z,Ugx6evE7F_8zNkoOfnR4AaABAg
@copeland5348,Thank God YouTube removed dislikes so now I can lose less faith in humanity.,6,2021-12-22T03:12:20Z,UgxxleZsyhhzX3oQsI54AaABAg
@jumibird,"We should no longer make victims of the Corona crisis. Lets all hang in there to overcome this disaster. Cheer up, everyone.",13,2021-12-21T11:15:02Z,Ugy6St_tQe8KxZfrx4J4AaABAg
@bradcollier4575,We need to hold China accountable,8,2021-12-21T10:07:41Z,UgwTKNKc1ECfeUOLZh14AaABAg
@nicolaeoboroc9076,I am very grateful that Kurzgesagt made a video about Coronavirus. Thank you!,14,2021-12-21T09:59:21Z,Ugw906sInA8GpOJAmxh4AaABAg
@jisoosoup4666,the anti vaxxers are gonna start dropping like fruit flies and we love to see it,8,2021-12-21T04:04:17Z,UgywKCh6OWi955pa1AV4AaABAg
@robertfuentes9677,Are you a fast pandemic or slow pandemic?,13,2021-12-21T03:47:46Z,UgxLr_xEiDjoS-pVymR4AaABAg
@moistkookie,The nostalgia of watching these videos in the beginning of the pandemic is hitting me lol.. in a bad way of course,37,2021-12-20T19:24:26Z,UgxplFCwT8-dmau02LV4AaABAg
@mrmacio111,Only thing you need to know about this is to switch off tv and switch on your thinking,10,2021-12-20T18:05:02Z,UgzihYZ8PHnH9EzHCoF4AaABAg
@moopi1075,"To think this could have been over quickly and effectively, without politicizing it or disregarding the deaths of thousands because of underlying conditions.....what a world we live in.",7,2021-12-20T15:07:30Z,UgzVVUbLn01GfN78PEF4AaABAg
@gaiusjuliuscaesar9296,a slow pandemic will not be remembered by history,105,2021-12-20T14:05:18Z,UgzLUFZ20rgu0aR9R3F4AaABAg
@LoliLoveJuice,"stay healthy and dont neglect yourself like what the doctors say to stay inside a confined room, take vitamins and get some fresh air for easy recovery.",11,2021-12-20T05:12:31Z,UgyPjJQ1_rBiSJGuSIl4AaABAg
@seanmichael9625,If anyone has Corona I feel for you this COVID sucks ,14,2021-12-20T03:55:14Z,UgwCza8ELKIHMwejimJ4AaABAg
@rosarosa981,These types of videos r SO important.,11,2021-12-20T03:43:24Z,UgwkIV54FjlIZ9QLL7N4AaABAg
@kingsleykehmo3547,"I appreciate the video, very useful and easy to understand. Do you do other bad sicknesses like Encephalitis? If you do please let me and others know. Thank you!",52,2021-12-20T02:27:26Z,UgxpE8zbJ12cXtVZeD14AaABAg
@dawidm9321,Really small price to pay?,7,2021-12-19T21:15:17Z,UgznpQXTEWSJzNU6wz14AaABAg
@sadatx9237,Turn the media off and you are happy.,8,2021-12-19T20:25:43Z,Ugz9urxnArFa-WFg8Q94AaABAg
@blueythesilly,Our kids are gonna watch this during history,17,2021-12-19T20:18:41Z,Ugw61JAs85Gtimo9QO54AaABAg
@Lucas-rk3ze,717 why is finland removed? hah,8,2021-12-19T18:49:32Z,UgyEw4voby-ij7VAY3x4AaABAg
@alexander1989x,"We can either have a fast pandemic, or a slow one.",1277,2021-12-19T18:19:38Z,UgxEbHnLJ66_bbbVgAV4AaABAg
@spschol,"Watching this almost two years on is borderline infuriating. So many people unnecessarily died. The response is always that we didnt know what to do but videos like this show that we absolutely did, we just chose not to.",8,2021-12-19T17:14:38Z,UgyvsQIhavSNyH2237Z4AaABAg
@philippecouche2192,The only thing we have to do is  to stop listening at medias !,9,2021-12-19T16:08:46Z,UgzRivLf60ZWtdMr5Ah4AaABAg
@franilovic4139,"As a person who had covid for nearly two weeks, I stayed at home and did nothing until it resolved on its own. Makes me wonder why vaccinating is promoted so much in all of the world",8,2021-12-19T12:25:40Z,Ugxj88CRwU2_MfmXNip4AaABAg
@waifusarecringeandugly5623,After 100 years of ignoring this video Im finally watching this,6,2021-12-19T08:07:00Z,UgxX6OPJe2pH8mSNbZZ4AaABAg
@Gigachad-ct2wv,"Who else was worried to click on this, worried to find a swarm of antimaskers comenting",6,2021-12-19T03:03:51Z,UgwrY6oPmtK-02c74XJ4AaABAg
@vodsanity4861,Sign here if you survived.,7,2021-12-19T01:13:42Z,UgzKWMS0hfUfLA60lBR4AaABAg
@Ytho_0q,I know this is off topic but I had a really good hamburger,6,2021-12-19T00:37:53Z,UgyXTBlmrDyO0E6C8UB4AaABAg
@thebelizeaneh,I dont have to watch any video to know what I should do. Exactly what I was doing for years before 2020. Live my life without fear.,6,2021-12-18T23:21:18Z,UgzIVitRyAIhgs5sHrF4AaABAg
@mrinedit,"When I had Covid19, nothing happened. Just some coughing and then it was gone.",6,2021-12-18T21:03:18Z,UgxbCK6SpNo4rdTum8J4AaABAg
@elbuddy965,Seen for fifth time in December 2021,19,2021-12-18T20:36:17Z,UgwlokXA7k328Jdm-Il4AaABAg
@MK-os8vl,"Its December 2021, lets see how many legends are listening to this masterpiece ",13,2021-12-18T10:23:31Z,Ugzu-45OKbu0AGsgNR14AaABAg
@Enderzombie2020,"man, the algorithm sure is scarry",6,2021-12-18T00:07:43Z,UgwNRKL2rm1IcwzyGB94AaABAg
@Kumori90,Corona causes immune cells to overreact and call bloody murder.,6,2021-12-17T02:45:39Z,UgzynrIIS5xIfBllWVp4AaABAg
@reniculous1559,a fast pandemic will kill millions,25,2021-12-16T06:05:21Z,Ugz-Xo58vim7m7w1lUF4AaABAg
@taylorwhite8483,"The sad thing is, you are literally forced to go to the hospital if you MIGHT have the Corona Virus in order to test if you have it. Since this virus spreads like crazy, that was honestly a very terrible decision.",9,2021-12-15T23:42:48Z,Ugz7e13HTELa551maGJ4AaABAg
@TrafficPartyHatTest,"Dont browse the comments by new, worst idea of my life",13,2021-12-15T19:02:45Z,Ugyywz8QdlMcknH8Sz54AaABAg
@turnoverbros,"Thanks for teaching me about this, I never knew about this virus",19,2021-12-09T04:25:48Z,UgyMLEwWqHdCqZkH2dp4AaABAg
@3OHT.,Dislike ratio for those wondering,8,2021-12-09T01:14:37Z,Ugy2iK6dHZiorlep7CB4AaABAg
@Tatexus,Since we dont have a vaccine Not true anymore luckily!,7,2021-12-08T01:20:46Z,UgxRNACGFMqzYIlCe1Z4AaABAg
@lightningslayer100,"We all know that 2020 is a bad year when you have this type of disaster, but if there was an even worse virus spreads on the same year, 2020 will become even worse.",10,2021-12-07T02:53:32Z,UgzUrQNMn8jTRmjlNcN4AaABAg
@timelessstone6835,AntiVaxxers and trump supporters be like,10,2021-12-07T01:38:16Z,Ugxk3YSduykL_mMw-At4AaABAg
@lorenzolibanori5153,"team! You are doing a great job! Please make a second part of this with data on vaccines, mortality, infection rates and other useful data to help us convince people in getting the vaccine! Thanks!",7,2021-12-01T06:52:56Z,Ugw5w8H4ihk8JJa8Edp4AaABAg
@randomhooman3236,being from india I saw both the possible cases of pandemic but still waiting for this pandemic to end and find the guy who said covid is not that dangerous everything will be normal after 15 days,7,2021-11-24T17:10:28Z,UgznVfiwFHoNXtrWheR4AaABAg
@manji6833,These comments are mindnumbing.,6,2021-11-16T22:18:37Z,Ugx-oBFhZZZNFBraZvF4AaABAg
@sorabrend5274,this video really just shows how early we knew and how those in power didnt do what they should have listened to professionals,21,2021-11-15T01:10:49Z,UgzwpkRQ_2jsPcPLQX54AaABAg
@grimsladeleviathan3958,"We can either have a fast pandemic, or a slow one",18,2021-11-12T12:43:37Z,Ugz4TDG97J9-Fd119Oh4AaABAg
@Holtijaar,"I think this video severely needs to be updated, because we actually have both pandemic types combined  its a fast and long pandemic. Also Id like to see more of the knowledge that we now have after another 1.5 year of studying the disease. Codensed and verified as always. Thank you Kurzgesagt.",14,2021-11-09T23:00:55Z,UgxA_DRBfNDXa5r6cRt4AaABAg
@ridhomblr,"The thing is, COVID made me rethink all the time before the pandemic happened, i underappreciated the time I was able to play with my friends and now, i suddenly miss them, its been 2 years of COVID and Im going to get vaccinated soon, im so happy.",7,2021-11-09T05:09:16Z,UgwB8fGdTxHwVk1zCF54AaABAg
@cageybee7221,"we can either have a fast pandemic, or a slow one",148,2021-11-08T03:29:44Z,Ugw8OyD3SffqN_yy1ul4AaABAg
@thestudentofficial5483,"Even when hastily made with simpler animations, the quality is still over the roof.",38,2021-11-05T09:31:22Z,UgwWwsTa9anuyW353Bl4AaABAg
@BLazeWigglytuff,The newest comments are tumor inducing,11,2021-11-04T22:29:18Z,UgyHOZUjCMAYTmoxGS14AaABAg
@youraveragegamer6177,I would have spent most of my time having fun in 2019 if I knew this was coming .,12,2021-11-03T01:02:12Z,Ugxn3p5uDOo8rKwoZUd4AaABAg
@Mooncat1134,Not surprised that people disliked this video probably all those conspiracy theorists.,26,2021-11-01T22:47:22Z,UgyB_EL3Kavv9jJAiE54AaABAg
@kaylakaterinazosa3729,"Its sad to see that some people in the comments are talking about Covid19 as though its already passed. In many other countries, were still in the thick of it",10,2021-10-22T09:01:53Z,UgxmN2WuuQ7YNUN6Sal4AaABAg
@sergiomarquina9659,This channel is the definition of quality over quantity.,7,2021-10-20T11:01:47Z,Ugxp_vKoUI3qmmMmObF4AaABAg
@banditartist4112,Last month I got covid,8,2021-10-17T14:49:30Z,Ugy1Ocxv4JCFYuU5wPZ4AaABAg
@Sebi.3,Our pandemic is like,7,2021-10-13T18:14:02Z,UgyupCW4DzcpdhjOK_Z4AaABAg
@HeloFish,"In the future, this may just get used as a documentary or as a nostalgic thing",23,2021-10-04T19:20:11Z,Ugxww4ES-PYr6IviaCl4AaABAg
@waltuhfr,"Kurzgesagt If they start fast with a steep slope, they end badly.",6,2021-10-01T11:15:13Z,UgzMQRvt20L-otqPuMB4AaABAg
@mineshnissanka7139,Can we please get a part 2? I think weve learned more during the previous year,267,2021-09-27T03:56:43Z,UgwyyttA-aFDFWJ1rm54AaABAg
@Grandflea02,"Government Here, have this vaccine which has had more funding and testing than any other vaccine before it, for an extremely cheap price",18,2021-09-26T16:43:45Z,UgwB-R4qLgNG8KD1gR14AaABAg
@RudolfMaster.,fuck that guy who started anti vax stupidity,6,2021-09-25T20:09:04Z,Ugw5l-CWvtQ6109Y6DZ4AaABAg
@WickerBasket9,"Almost two years later after COVID first broke out and seeing how the world is today is just... surreal, like if it were a scene from a postapocalyptic movie or something... Its spinechilling!",21,2021-09-23T10:59:12Z,Ugy7YjIZ6sHrMsqO39R4AaABAg
@RaymondLo84,This aged pretty well We basically did all the worst case scenario,133,2021-09-21T05:37:28Z,UgzLd140PpXbCJwXtfR4AaABAg
@chi3kenleo299,Why cant people just take the vaccine  its so easy,6,2021-09-20T10:02:27Z,UgyZEYfPXkfLdasSEM14AaABAg
@dumdumbanana,Kurzgesagt there is no vaccine,12,2021-09-18T16:03:46Z,Ugx6TGp5GiMnJ8Bsw8R4AaABAg
@robertbones326,"I love the fact our own immune system is so dangerous it can actually harm us, and other cells are needed to regulate the immune system and basically say relax. Its like my immune system is a viscious pack of dogs ready to F s hit up",14,2021-09-18T09:14:20Z,Ugws6Vv1o7BYYOS2ECB4AaABAg
@therret2901,Watching this while suffering through a week and counting of brutal covid symptoms just hits different.,9,2021-09-17T04:39:33Z,UgzX3Ah7U3cpqRO_rw54AaABAg
@kepler2560,I like how most of the commenters  suddenly became professional scientists,8,2021-09-15T13:19:33Z,UgzIWGrnUoTk1piRwxR4AaABAg
@alinaitzal1173,I hope everyone who is antiVax gets to hang out with my friend Bernardo who died of Covid19 last year... I hope you meet him VERY soon.,10,2021-09-13T03:29:52Z,UgzuOqbzDo3OIqMpmch4AaABAg
@trendgaming3924,"Speaking from a late2021 POV, we all underestimated one thing  human stupidity",640,2021-09-12T02:43:38Z,Ugwj_IXQryzlQ3JcUPZ4AaABAg
@WhoLetTheDogOut,Whos here after Biden announced the Vaccine Mandate?,7,2021-09-11T03:05:10Z,UgxvW4lrQJL21cpUxBJ4AaABAg
@bluefordpickup,"If COVID is undercounted, just imagine how severely undercounted the FLU is.",12,2021-09-07T19:58:00Z,UgyLO94Y9IcYoNkN0K94AaABAg
@BrettJamesSuperRoach,It feels bittersweet watching this now.,13,2021-09-07T14:06:27Z,UgwFNvYauL3BezvEYM54AaABAg
@gans666bg,So coronavirus most dangerous weapon is literally misinformation...,8,2021-09-07T03:21:49Z,UgxiIzEx1ISEz4lmPtR4AaABAg
@Isaah.i,Its still disappointing to see that to this day some people in my country still dont believe in covid. They said its fake and its not real.,39,2021-09-06T02:55:36Z,UgzF93lCZBAuvNQj_Xx4AaABAg
@KrYPTzx,Man I salute those who make the subtitles and those who thought of adding them they are pretty useful and allow many people who dont understand english to understand the video,6,2021-09-05T09:45:02Z,UgwTHcE694OhvuYDpsB4AaABAg
@sunwasee300,A moment of appreciation for the Frontline health worker who is working hard to reduce this pandemic as much as possible,7,2021-09-05T09:21:52Z,Ugw22NomO4dNeEmklZV4AaABAg
@JNSStudios,739  741 none of this is fun.,13,2021-09-04T14:54:11Z,UgybzdT8gQokyc3L6ht4AaABAg
@4X4NAV,A slow pandemic will not be remembered by the history books,1220,2021-09-04T14:08:11Z,Ugym_GGvslC8j_r5llh4AaABAg
@simonmichaels8765,I would love to Kurzgesagt to make a second Coronavirus video  talking about where we are at now almost 2 years later with vaccines. I used this video as part of my PAC training for staff. Good job Kurzgesagt.,900,2021-09-04T03:01:39Z,UgxHUmOSY9GMAq4_mAJ4AaABAg
@lonick1692,Every now and again I come back here and remember the amount of panic in the world. I dont think Ill ever forget it.,21,2021-09-03T14:39:27Z,Ugxc1MEgnetZe8NP5Xp4AaABAg
@yua-chan8445,Its weird to think that if Corona becomes super mild were going to look at these videos like lol remember that guys?,20,2021-09-01T02:35:51Z,UgzTg_z2-0mhL0D3T5Z4AaABAg
@Skunkflea,"i was surprised no covid deniers  antivax cultists were in the comments, then I realized this is educational  based on facts so not really the sort of thing that they are into!",9,2021-08-31T17:48:53Z,Ugy3tGNQlxYngSNL_zh4AaABAg
@admxMC,Well china didnt tell us a scientist told us... Who was sent to prison,6,2021-08-31T01:03:24Z,Ugzakdb3VLOPY0giddp4AaABAg
@Gayassraccoon,Americans before covid spread oh Noo Im gonna infect you haha,9,2021-08-30T06:16:17Z,UgzV5_f_dYy1KQWolmx4AaABAg
@cowplatter5320,"A note on social distancing you guys got it good. If this happened in the 70s or 60s, you wouldnt see anyone in any form for about 1 122 years!",10,2021-08-29T03:45:04Z,UgxhFjsGjQ9CqBxrlmF4AaABAg
@GraemeGunn,I still cant believe the people who have latched onto this whole thing being something political in nature.,41,2021-08-28T14:21:25Z,UgxqB4ddl2wyGPhDLVt4AaABAg
@aworm,"The 15k people who disliked this Oh no, the government got to Kurzgesagt! They must not have been wearing their tinfoil hats!",29,2021-08-27T08:03:37Z,UgwpN689_Z8-BGN4zSR4AaABAg
@arteckjay6537,"Its haunting to hear Kurzgesagt explaining the worstcase scenario, then realizing that thats wordforword what happened in my country The US.",12,2021-08-27T00:45:08Z,UgwW5F0ZyS3gt3MP5_B4AaABAg
@Huntress_Hannah,"This will turn into an endemic, itll be with us forever at this point. Dumbass antivaxxers",6,2021-08-24T17:52:30Z,UgzR25EGdOnLEWiM9sB4AaABAg
@ninoherrmann1514,Soooooo that with the slow pandemic. Yeah that really didnt happen.,6,2021-08-23T20:15:08Z,Ugx1k2bv_AuBjz3W-N54AaABAg
@JuneBee83,"Kurzgesagt, you should make another coronavirus, with updated data. It would be interesting to see what we didnt know then that we know now.",71,2021-08-23T08:02:05Z,Ugzm5NI55c8-UGUv8yB4AaABAg
@thatcrystalpie,sorting by newest is a nightmare,7,2021-08-22T22:35:35Z,Ugxen-2Jjp3dbXTxpyN4AaABAg
@DryPsylocibin,"Wash your hands as if you just cut up some jalapeos and want to put in your contacts next. Yep, missing that is a mistake you tend to only make once.",22,2021-08-19T22:33:51Z,Ugy1wjGUa6Y3SvYBHv94AaABAg
@geoffreyblankenmeyer9888,"Express your freedom.  Stay unvaccinated and maskless.  Gather together in a closed environment, then test out whatever homeopathic cure you learned from Fox, et. al.",6,2021-08-17T22:07:35Z,Ugw7lDiatZBKL927emR4AaABAg
@AGA-q3f,"the pandemic has 2 futures, fast or slow",823,2021-08-16T11:04:52Z,UgwXaSyz70MP95M4wnZ4AaABAg
@keegankoegelenberg6863,I would really like an update on this video and also one about the vaccine... love the channel and all the content ,13,2021-08-16T06:54:58Z,UgxXN7DzHUIkWabCQol4AaABAg
@necrozma4029,Karens Im gonna pretend I didnt see that.,10,2021-08-16T03:47:09Z,UgwuFRIsa7wgmkhRIj94AaABAg
@DRTerabyte,"Id like to see a Part 2 to this, see what weve learned and how the vaccine has helped including whats to be expected going forward.",8,2021-08-16T02:12:19Z,UgyB2CuEtfu11Cc9cVZ4AaABAg
@kaleb749,"We can either have a fast pandemic, or a slow one",3548,2021-08-15T23:40:44Z,UgzzAP_yE8Sc9ZuOOBx4AaABAg
@DSmittie,POV youre sorting by new comments to see all the virus deniers and insane people,11,2021-08-13T15:31:21Z,UgwyRcLlauMEyKLiPJN4AaABAg
@Fluxuation,"Im so happy that this is their most popular video, god bless everyone who is fighting the virus in the front lines.",85,2021-08-12T02:39:43Z,UgwDkHa2IbyC0U1qehp4AaABAg
@hhairball9,Its sort of disheartening watching this more than a year later. It was a great message. Its just no one listened.,136,2021-08-11T05:33:53Z,UgxD0qyWZjJMQgCpuFt4AaABAg
@facepalmdaily4404, a slow pandemic will not be remembered by the history books.,109,2021-08-10T19:19:53Z,UgwJCXCPng9iM-90hSt4AaABAg
@gabebancroft,We dont have vaccines for this yet,51,2021-08-10T17:11:41Z,Ugw3zoNLuxaYvj81kSB4AaABAg
@TheKialish,"Watching this over a year later is depressing and painful. The information is very cool though, to understand what the virus does",256,2021-08-10T12:37:44Z,Ugx8OMh52Yszi8g0MeV4AaABAg
@loremaster8475,"Infected Tcell alright men, we did well enough time to go out with a bang.",10,2021-08-07T10:46:55Z,UgwpCKCSQ5sxtXZK2_J4AaABAg
@cccubed8054,"The sad thing is even after a vaccine has been developed, people still dont wanna act reasonably. SMH",24,2021-08-06T20:34:22Z,Ugz-Eve2IMY85ceT55t4AaABAg
@alexshi1962,"Unfortunately, there is no vaccine",659,2021-08-06T18:10:06Z,UgzVqLDQKX1UlSFTUBN4AaABAg
@DurpeeSlurpee,Ah the good ol days when we just needed to flatten the curve,1535,2021-08-06T00:52:21Z,UgwWyBbCk1914RCA9Nl4AaABAg
@arminsattari8253,"Cant believe there are some mother fuckers out there shouting corona doesnt exist and dont want the vaccine. Oh but its the freedom of choice  shut up your freedom is more important than a life of other people, if you like that congratulations your a KAREN you get that",8,2021-08-05T20:26:59Z,UgytqnFhrk303dloUPh4AaABAg
@nickyhr,I like how we all just keep coming back here. Kinda shows you how big the entire pandemic is doesnt it...,17,2021-08-03T18:45:09Z,UgyDQIbJztA7eSFixz54AaABAg
@oneofthelastsurvivingdoges8832,I remember reading a news article about some strange flu that had infected 14 people in China. Surreal...,646,2021-07-29T11:27:08Z,Ugy1H-VKyh9c_ch25P14AaABAg
@misterbig9025,Its July 2021. We have COVID still with more mutation variants.,13,2021-07-29T05:04:03Z,Ugw-ci9BnKfkGvXZ1MZ4AaABAg
@andrewmd10,"Now that we do have many different vaccines, people and govs dont want them. Amazing",61,2021-07-27T17:21:06Z,UgyzsxR_D3uBKy5uE794AaABAg
@GHOST-dg5tk,"Its insane that some people just dont care about any of those rules, just stay at home and keep your distance. The fact that you dont want to doesnt allow you to endanger others",7,2021-07-26T09:15:45Z,UgyAr8qlqBnIc8rDV014AaABAg
