Author,Comment,Likes,Published At,Comment ID
@Dontjudge103,"Can we just appreciate how fast Kurzesagt have managed to release this video. Thanks youre appreciated by everyone, were also working on a video soon to educate people on the seriousness of this invisible disease",102,2020-03-25T15:55:40Z,UgxwuIrXTsqHIaOug9Z4AaABAg
@soapdispenseraliens8865,girl come to my house,30,2020-03-25T15:28:51Z,UgyfKmEl0-t_Hk9H2Bl4AaABAg
@janin6473,Body gets infected by the coronavirus,81,2020-03-25T15:26:29Z,Ugzqya4_f1hDgaz6hix4AaABAg
@jaydenphung4369,I just realized this,65,2020-03-25T15:19:31Z,Ugw4jS1GauVYWKHfwyN4AaABAg
@format1498,Everyone Washes hands after watching,942,2020-03-25T13:51:13Z,Ugyux1mADvq0FpbEWXt4AaABAg
@jessibaet5828,Kashmir was grounded since August2019...Thats the literal definition for Hibernation!,14,2020-03-25T11:01:30Z,UgxCwj0vSmlnzPwErpl4AaABAg
@jerome1471,I can imagine characters from cells at work  while watching the video,42,2020-03-25T09:48:23Z,UgxataRmCTncHqRnqUJ4AaABAg
@Potemer,I like how the monkey is holding toilet paper in the intro.,12,2020-03-25T08:29:11Z,UgwHLA-8ob5ObcRBRiV4AaABAg
@romeomike62,"If youre put under Quarantine, you should understand why and respect it",324,2020-03-25T08:13:43Z,UgzLcVaooLs-NCknXP14AaABAg
@tidepods5506,"There are 2 futures for a pandemic fast and slow. Which future we will see depends on how we all react too it, in the early days of the outbreak",6,2020-03-25T06:59:18Z,Ugzk_1YfIe0MYH9XovZ4AaABAg
@subscribeoriwilltakeallyou758,COVID19 ATTACK MY MINIONS!!,57,2020-03-25T05:30:18Z,Ugzvnfj5iZID3xCDnkl4AaABAg
@waseymaqsood7583,"Not to brag or anything, but I washed my hands with soap before it was trending.",51,2020-03-25T04:36:43Z,UgwIPF0mEvTQQh0gcS14AaABAg
@aaryanchokshi3862,734 Exactly what Im doing right now,7,2020-03-25T03:30:40Z,UgycefxShiUR_yQiJRN4AaABAg
@TheEmeraldTrade,"Whenever someone says not to touch eyes, my eyes start to itch",40,2020-03-25T02:20:36Z,UgxrAqO5eJ_RB3In3yB4AaABAg
@IxiaClover,did anyone elses lungs feel really uncomfortable when he was explaining how the virus infects them... or is that just my indigestion,119,2020-03-25T01:44:26Z,Ugx5t1DTqXXq-zgeJAl4AaABAg
@albinocake,Killer T cellhey commit suicide,6,2020-03-25T01:27:58Z,Ugze8_wwcit9rJGqYlJ4AaABAg
@ched7591,People having Covid19 have urges to travel the world.,16,2020-03-24T22:05:52Z,Ugxu_OxFvl9Bx1my97N4AaABAg
@MrMoustacheNinja,The bird licking the window made me lose it ,69,2020-03-24T21:46:00Z,Ugz-IIyPH1iqBLX_Fkd4AaABAg
@shantcheetah,"to everyone out there stay safe  stay inside, but most of all, STAY CALM. panicking wont lead to anything good.",622,2020-03-24T19:24:46Z,UgxTEyGYCFg6dw_CNyx4AaABAg
@kkennyyydo3556,Kurzgesagt  Being quarantined at home leads to a slow pandemic,36,2020-03-24T16:36:26Z,UgyNAcdgaSPL_pX0IIt4AaABAg
@jhon.e4437,"These are the times where I just wish everyone is Chuck Norris and be like After 5 days of agonizing pain, the virus died. Godbless us all.",19,2020-03-24T16:25:16Z,Ugw8003JA8c7hnJ88CV4AaABAg
@PHCuber,Kurzgesagt makes video that will be demonetised anyway,10,2020-03-24T14:44:17Z,Ugwi3_fq9yiVwRMafZJ4AaABAg
@ninetiespoets5548,I wish corona was long gone when i see this comment again.,426,2020-03-24T13:22:31Z,UgwrnHSt3sknsmna6bV4AaABAg
@Katharoni,A fast pandemic would be very bad.,24,2020-03-24T09:53:48Z,Ugx9yBf7zlsjB4t61Pp4AaABAg
@karenzhen3530,"As an introvert, Ive been training for this quarantine my whole life xD",415,2020-03-24T08:45:46Z,UgyED37SG26kMkpQ0Vd4AaABAg
@hello.bye.2087,002 oof they didnt notify the world until the Doctor said it first. He died of Covid19 also. RIP Doctor Li,40,2020-03-24T08:39:47Z,Ugxl333hc18W4CLU4uJ4AaABAg
@Wayne-tw6vv,253 I suppose you meant Neutrophils rather than Neutrophiles,23,2020-03-24T07:15:51Z,UgyTvTEQyp5a52NOhAN4AaABAg
@Inquisitor_Jeff,"Unfortunately, I live in the U.S. where this whole thing has been handled as well as a chimpanzee trying to build a car engine, so Im just gonna lock myself away for a year and brace myself for the horrific tolls to start scrolling by in the news feed...",64,2020-03-24T06:57:03Z,UgxNHpvCu3dAXYW4bqR4AaABAg
@mrjordan7304,Can we all give a shoutout to the immune system. Underrated hero,66,2020-03-24T05:39:32Z,UgyXmlObMAvYxZjWa0l4AaABAg
@piecemakernoalias1018,Obviously its just a cover up to prevent us from using air travel so the government can keep us from realizing the earth is flat,10,2020-03-24T04:26:13Z,UgyOslA_MUlNxu8Ao5F4AaABAg
@exoboi6974,Most people No! I have to stay at home!,74,2020-03-24T04:17:19Z,UgyTUUXTYnqqjyigEM54AaABAg
@QuadSazer,People with flu Stay at home,226,2020-03-24T03:47:40Z,Ugzm5Ea3jNnEUqkJRM94AaABAg
@alansaadatian5572,This video didnt even feel like 8 minutes to be honest. I was so focused on what was being said in the video that i wasnt even paying attention the time. Great video,61,2020-03-24T02:52:47Z,Ugz1dfdqgd7VLRvPRWN4AaABAg
@andrewaugustin3769,"The CCP covered it up till mid January though, they did not alert the world about it in December.",10,2020-03-24T02:04:07Z,UgyaxV9rQxneqmikt914AaABAg
@eonsprite6109,"This should become a unskippable ad, and the only way to skip it is to take a test on how to stay healthy",30,2020-03-24T01:21:11Z,Ugy09402M35yhQ7yL5h4AaABAg
@kainatafxal9741,One of these days im going ti learn how to pronounce kurzesagt,102,2020-03-24T01:10:22Z,Ugzk8oGmd7NGVNOhm-14AaABAg
@nhkumzaubawk,2003 My grandpa died from SARS,45,2020-03-23T23:48:31Z,UgwEsUQFtm0ntgubkY54AaABAg
@mintydog06,Corona causes infected immune cells to overreact and yell bloody murder amazing. These videos are brilliant and they make the topics easy to understand.,114,2020-03-23T22:48:07Z,Ugyj9ndlyZ4Ku3O8P8l4AaABAg
@abdihassan7208,When you learn more about the Corona virus in 1 video than you have in the past 2 months from bullshit news reporting and crooked politicians...,63,2020-03-23T22:24:30Z,UgzExVMC8S1NxzELdC94AaABAg
@abdihassan7208,Youve done in 8 minutes what most TV stations have been unable to do in weeks! Thank You!,496,2020-03-23T22:18:20Z,Ugxk5IGQ8f21AL-msDx4AaABAg
@abdihassan7208,This video alone has informed me about the virus in the most calmest and professional way! Thank you Kurzgesagt!,83,2020-03-23T22:17:26Z,Ugy0J3F6_8wX9Uy2aVl4AaABAg
@whenyoupulloutyourdickands4023,Severe Acute Respiratory Syndrome Related Coronavirus 2 Electric Boogaloo,99,2020-03-23T21:57:06Z,UgwYtw98t2jd9AVEvTx4AaABAg
@dpnmodi,"This needs to be broadcasted on TV, every hour, every day, for 2 weeks, globally.",14,2020-03-23T18:36:54Z,UgzIIDGRp9UXfwSc18l4AaABAg
@KimChou-dp4nf,Society  Coronavirus outbreak,59,2020-03-23T18:33:02Z,UgwBqfOhMmGkytMJicZ4AaABAg
@ManishKumar-tg7ge,"slums cant afford sanitisers, lack clean water to prevent coronavirus spread..",12,2020-03-23T16:53:12Z,Ugz0A7FwG505bHFRx754AaABAg
@eclgaming1516,"727 the bird is licking the window, that isnt very healthy",87,2020-03-23T16:21:10Z,Ugzl24yeMe4NisJpL4x4AaABAg
@filthyfrank500yearsago9,Humans  lets make the pandemic slow,43,2020-03-23T15:52:55Z,UgwbJJ02VSUzNnaW_0N4AaABAg
@dontlookatmyname5322,This video was actually in the news,1475,2020-03-23T15:27:20Z,Ugzmhg0NNihIEqGqf-J4AaABAg
@RomyJenit,The horrible decision of who gets to live nd who doesnt sounds chilling sadly this is what italy is going through rn ,15,2020-03-23T13:37:04Z,UgyrAb0iXFzBreU9d5V4AaABAg
@duaawaseem8964,I can already Imagine that our future generations will be learning what Is corona virus ? for exams.,8,2020-03-23T13:28:29Z,UgySBUIC0TMqz0IJzVp4AaABAg
@OriginalRaveParty,Cometh the hour. Cometh the Kurzgesagt.,84,2020-03-23T11:51:45Z,Ugx5tB3AWIeYSKnpnxl4AaABAg
@adityaarayan2340,Even slow pandemic will be remembered by history books so that in future we are more prepared to fight against these biological demons,135,2020-03-23T11:11:53Z,UgzpQgI9rZiM4L3U2t14AaABAg
@sidnynasty7908,4 days later and Im starting to think the fast pandemic is the route were heading down ,22,2020-03-23T09:39:49Z,UgyjrbxxdmG3c0LdYhl4AaABAg
@wanzongyi1200,MeSearchs up hand sanitizer on Google.,17,2020-03-23T09:31:28Z,UgxkbikHidW0MUpglXZ4AaABAg
@nethulvithanage894,Me Sees this video 4 days later.,55,2020-03-23T09:22:58Z,Ugw2WOvclurUoC6ayyx4AaABAg
@salvo403,There are two futures for a pandemic like Corona fast and slow.,81,2020-03-23T09:17:06Z,UgykeOJc83EmIJQnMu54AaABAg
@juykerudle275,Staying home is not fun,245,2020-03-23T08:51:06Z,Ugy4vPUbWGZ9TvkRkex4AaABAg
@mathacademy8909,"Someone is playing plague inc right now , he hasnt stopped playing since 2019",152,2020-03-23T08:36:17Z,UgxzDQzUAbwyDi7dBmJ4AaABAg
@me-lz7jb,scientists wash your hands with soap and water regularly,25,2020-03-23T08:36:06Z,UgxXtf6XJbLZmfv27dJ4AaABAg
@laurensmith5050,Wash your hands like you just cut up a jalapeo and want to put a contact in your eye  perfect way to encourage people to wash their hands PROPERLY!,841,2020-03-23T07:21:06Z,UgxisMAkx29o9FAUQJ14AaABAg
@commonman2978,This needs to be shared as much as possible.. as soon as possible..,15,2020-03-23T06:25:25Z,UgzdEFPFyPBUNOiDon14AaABAg
@moonbound6478,"Ive been wearing gloves for about a year and half, and all my friends thought it was weird. Well look whos laughing now",8,2020-03-23T06:23:32Z,UgwBU9l5S4qf94eBHB14AaABAg
@Top10Archive,Coronavirus is the ctrlc and ctrlv expert.,174,2020-03-23T06:18:00Z,UgzNfhefEGyAlzSn9zd4AaABAg
@azyn1525,Corona virus in a nutshell As extreme as multiple DDoS attacks on a single computer,56,2020-03-23T05:52:39Z,UgzqWvPBnYCS2w_GmNJ4AaABAg
@hirokaitabasi5008,Can Everybody Just Appreciate How Good They Animate This,486,2020-03-23T05:37:40Z,Ugx4_kKWejfBrPNVA7Z4AaABAg
@earthwascool8377,When you make a bat soup and its so good that all the world knows about it in a month,14,2020-03-23T04:43:47Z,Ugzf2UrtpP9doplMj8l4AaABAg
@LordBummingtonThe3rd,730 I also lick windows when stuck at home.,12,2020-03-23T04:37:21Z,UgyI1wH2yzEfMNMTOel4AaABAg
@Orincaby,google its just a cough and a fever,29,2020-03-23T02:33:24Z,UgziSxR2LxALOhhydgt4AaABAg
@technohacks8302,People corona is going to kill everyone,99,2020-03-23T02:22:32Z,UgxPQOJl2PWLQpfbzZ94AaABAg
@kingofcats9673,Everyone laughed at me for being an introvert look whos laughing now,221,2020-03-23T02:08:26Z,UgxFBYHEU4Vv_PppcQR4AaABAg
@antoniasalinas513,"Notice how toilet paper has nothing to do with coronavirus. Also remember that surgical masks dont work, they were made to keep LIQUIDS out, not viruses. Other people need this stuff.",1907,2020-03-23T01:47:36Z,Ugz6uvQ6gvEojX16eBF4AaABAg
@cocodelpino2582,who gets to live and who gets to die already happening here in Spain ,382,2020-03-23T01:14:41Z,UgyVWcec8ltOwV7q7XJ4AaABAg
@em5522,"732 I wouldve thought youd want to avoid licking windows during selfquarantine, but maybe thats just me. ",13,2020-03-23T00:27:00Z,Ugx-4dL7tU6B7DGeZK54AaABAg
@zachconant7031,"Remember, the Chinese government tried to hide this. If they would have actually taken action 95 of the spreading could have been drastically diminished.",37,2020-03-23T00:22:04Z,UgzLn3kPXYnHTuT4ENR4AaABAg
@dogsarecool6530,What should we do??,54,2020-03-22T23:12:11Z,UgzAvgPZbH3R-p2o58l4AaABAg
@thetayz72,"Imagine, if you will, a world where everyone washes their hands and avoids spreading their illnesses by default.",620,2020-03-22T23:10:50Z,Ugywo61db7nETonPLaJ4AaABAg
@HippyInASuit,"Correction, in December 2019 Chinese officials were silencing and abducting scientists and journalists who tried to spread information about the virus.",23,2020-03-22T22:50:58Z,Ugzmyq2epmpACCoKM0p4AaABAg
@ble1470,Kurzgetag Wash your hands with soap its the best decision,39,2020-03-22T20:12:47Z,UgwIttmeR0cbV-OSeh54AaABAg
@ble1470,This video is giving me anxiety and my lungs feel weird......,23,2020-03-22T20:09:08Z,UgxO-JQg3Uxjt7yRB_V4AaABAg
@alexlorius,World staying inside and keeping their distance  introverts this is are world,9,2020-03-22T20:08:09Z,UgyA01R-AZCKdQAwHop4AaABAg
@EmperorPrinc3,Who gets to live and who gets to die,44,2020-03-22T20:06:48Z,Ugz7Pd2AWoIKfZxgjk14AaABAg
@pedrod6768,"Here, in Spain, we have been in quarantine for more than a week, and we applaud every day at 2000 in the honor of people of hospitals, police officers, and workers in supermarkets. ",14,2020-03-22T19:31:21Z,UgxP3iyxttmeMdIr5Ut4AaABAg
@ber093,"When Kurzgesagt said The World , it looked like time slowed",26,2020-03-22T19:28:25Z,UgwFvHUSg4KsfjAREEl4AaABAg
@cheer90099,The monkey holding the toilet paper in the beginning was a nice touch. ,10,2020-03-22T19:06:04Z,UgyU_2aBvWtuoiKcBVl4AaABAg
@rbnhpp,Government Stay at home as much as you can!,560,2020-03-22T18:48:38Z,UgwrjUo8a0MjKss0GO14AaABAg
@alijawad_19,2030 man has used the last of the toilet papers his parents bought in 2020,230,2020-03-22T18:48:21Z,UgxVp5hdZXqW8rfqTwZ4AaABAg
@harunlisic,"They Should make quarantine every year for like 1 week, Quarantined cities are Living Example of how much air and water in them have cleared out.",18,2020-03-22T18:42:17Z,Ugy0O6pxXhx6tJXVdGt4AaABAg
@blacksheepous,This channel is once again showing an enormous amount of responsibility for human welfare in general and its education in particular.,19,2020-03-22T18:35:01Z,UgyMAFi1yEUFn4FP-LF4AaABAg
@stormbornking,"Its already too late to start slowly I think... As Shakira said in her video on social media, the virus is too fast and the world leaders are WAY too slow.",7,2020-03-22T18:08:18Z,UgzDlA9s0UW-jTzPU194AaABAg
@NisharthRajput,Horrible Decisions has to be made about who gets to live and who not...,1109,2020-03-22T17:25:43Z,UgzWI2Z8GbpLvSHW2Hd4AaABAg
@harrison1986a,"While i agree with ongoing measures, if we tip into an economic recession or depression, the history books will indeed remember the slow pandemic or curve flattening,.",18,2020-03-22T17:21:19Z,UgwUr07MgdVoDDWIUJ94AaABAg
@pianowithnikko8943,After months we finally develop a vaccine,223,2020-03-22T16:43:08Z,Ugy3tr3PI5OvXX5srB94AaABAg
@UltraWhale,"Meanwhile Sweden is doing everything to turn this into a fast pandemic, smh..",27,2020-03-22T16:38:28Z,Ugz-E5qLUL_OWgSUoFl4AaABAg
@NaenaeGaming,Anyone notice the gorilla holding toilet roll instead of a mouse in the intro?,12,2020-03-22T16:34:07Z,UgwatzpSJoQKS_L3ttV4AaABAg
@localnyraccoon,Virus why hello there,31,2020-03-22T16:01:32Z,UgyjMmmPRY3VmFf9ZCp4AaABAg
@marco.trevisan,"I love how in the intro, at 028, the primate holds a roll of toilet paper he didnt in previous episodes.",500,2020-03-22T15:52:27Z,UgyLeoNBjQjC7fK0XGJ4AaABAg
@fuatkahraman5142,In December 2019. Chinese authorities notified the world that a virus was spreading through their communities.,6,2020-03-22T15:43:18Z,UgxF92G7u1g7x3Jo2Lp4AaABAg
@wessonsmithjr.6257,The major negative aspect of  flattening the curve  is the drawnout economic damage that is occurring.  We might find that we have more people dying from negative economic damage as opposed to COVID19.,12,2020-03-22T15:10:38Z,UgxwKtGXZmoqUhFrZ5l4AaABAg
@alissa3196,People in the future are gonna be like,390,2020-03-22T14:03:20Z,UgxQiHFJRt45byr49ZF4AaABAg
@LeoStorm007,Thank you kurzgesagt.  As a doctor I can say you have covered everything and in a simple way. Now its easy for me the share this video and spread the message.,30,2020-03-22T12:29:38Z,Ugz7eYA8Ykvnrqww9hB4AaABAg
@Mc-ue1zw,"Im gonna die here because of my family members. Tried telling them, they wont listen. Hope this ends",13,2020-03-22T12:14:11Z,Ugz-gbqgdMOayprEyo94AaABAg
@HugoLee0105,"In hong kong, we call it Wuhan Pneumonia, or Chinese Virus as they eat wild animals like bats or civet while these animals carry the most deadly virus.",6,2020-03-22T12:12:43Z,UgwTpfMf2zDjKEeF_gZ4AaABAg
@chrisraccoon1726, virtual hugs to everybody. take care,58,2020-03-22T12:02:39Z,Ugzkptd0VEnCtabQOUl4AaABAg
@batmaneater6222,non of this is fun,73,2020-03-22T10:50:34Z,Ugwk-QnH3vr_CjDXDHt4AaABAg
@alexzitao059,coronavirus accidentally infecting an cancer cell Execute self destruction order.,66,2020-03-22T10:41:51Z,Ugz_G_a4hl5_tGySoz54AaABAg
@nonsensehorse5777,"I live in Poland, and were told to stay at home, but it isnt a break. The teachers send us homework via messenger or make online classes.",68,2020-03-22T10:16:23Z,UgzOfrPd6zIqqLBD8id4AaABAg
@ArchangelWolfy,Thats crazy a whole world of cells going on inside us!,58,2020-03-22T08:23:05Z,UgwhKJtY-i0OrUjhTr94AaABAg
@bananaman83,"Hang in there, world.  Well get through it.",6,2020-03-22T08:11:03Z,Ugx5JYj9VWQfHyaMk1p4AaABAg
@StevenSenjaya,THE BEST EXPLANATION EVER. Everybody should watch this,241,2020-03-22T07:51:01Z,UgyCKm2XuTR2ccusjSR4AaABAg
@tommuggeridge5659,you know the coronavirus is bad when Kurzgesagt starts uploading a lot,219,2020-03-22T07:39:25Z,Ugz97I9xGXbSZkIOh5d4AaABAg
@tazochaiguy,This has been closedcaptioned in so many different languages that I am going to send it to as many friends around the world as I can! This is a great public service! Thank you!,8,2020-03-22T07:33:27Z,UgydD4eWaAGagMzKqGl4AaABAg
@MrBubblygoodness,"Thank you, its finally clear to me what flatten them curve really means and why it is so important to keep the curve flat.",10,2020-03-22T07:00:06Z,UgzRERehMbJCPXZ6j-p4AaABAg
@kenwood7095,This is Event 201 NY city oct 2019 playing out.,9,2020-03-22T06:50:11Z,Ugy23v0WAuvU2j-rRIp4AaABAg
@Sparkz1607,"To wash your hands properly, act like youve just cut jalapenos and want to put in your contacts next",875,2020-03-22T06:26:31Z,UgyREryBQm8AUgluu314AaABAg
@prabhasenju5259,Earth in 2021  humans used to exist here,8,2020-03-22T05:25:26Z,UgwXkC3ECBrGtPw-O4F4AaABAg
@speed2574,Normal sick people Stays at home,335,2020-03-22T02:58:50Z,Ugxy_1IkQeUGV5sjjTx4AaABAg
@Bo2Section,Quarantines are not great to experience and certainly not popular,49,2020-03-22T02:48:40Z,UgxBh3HIGb6-yRpmw354AaABAg
@_iMamba,"Anyone else notice that with the Covid19 outbreak, antivaxxers have been eerily quiet?",398,2020-03-22T02:26:32Z,UgxIxtsbJaggsh00jDR4AaABAg
@silverhawk7324,Finally the normies get a taste of the hikkimori life.,19,2020-03-22T02:03:54Z,UgxFglvPNuL27Cln0HN4AaABAg
@mikkatzuki2225,727 ew why didnt the bird use its wing to draw? lmao licking the window,31,2020-03-22T01:53:38Z,UgwS9R4Z9w2BNcD41Ep4AaABAg
@flipscus4098,People in the future are gonna be like WhOs HeRe AfTeR tHe ViRuS,780,2020-03-22T01:36:11Z,Ugxz_4NvEsuEI7t6HQt4AaABAg
@RadioHouston,Attacks the immune system. How convenient.,12,2020-03-22T01:17:42Z,Ugy96hmDAOkdNb9KmEt4AaABAg
@SaintsCheat,028 I blame that Monkey.  Just sayin ,66,2020-03-22T00:32:51Z,UgwFLIRxgDV8_Q7Hoi14AaABAg
@Johny_D,607 Any one notice the low left person left the hospital in the infected condition? No? Just me?,140,2020-03-22T00:05:25Z,UgzZnfzJgLDzd5LU5D14AaABAg
@jhova,Yall really grinded this one out holy shit,17,2020-03-22T00:01:18Z,UgxghInHbpMhZGrsJH14AaABAg
@onatgz,im amazed how you could do this vid after a relatively short amount of time especially after that how to kurzgesagt vid. gg.,67,2020-03-21T23:42:56Z,UgzWvQ0umkUUF4zLmKV4AaABAg
@jmandoeskarate4456,Kurzgesagt So... heres what to do,118,2020-03-21T23:40:31Z,Ugy65GhRb5NerxOIi1F4AaABAg
@protonaselototm4006,"Hey, Corona, if youre watching this, know that you aint that powerful and indestructible! Yeah, you might be extremely infectious and fatal in some cases but isolation would be your worst enemy!",17,2020-03-21T23:20:42Z,UgzyNQqT7RYQJZj4L3d4AaABAg
@alexmiguel2725,The Chinese government tried to cover it up.,6,2020-03-21T22:46:34Z,UgzIHREUGdE15ysa8qZ4AaABAg
@user-cu4ru1om5t,"social distancing, which is not a nice experience",90,2020-03-21T22:45:26Z,Ugz7VCCTwPOt-txT1BJ4AaABAg
@BlooditeDrakan,And people say just a flu bro.  hearing what it actually does makes them sound even more ignorant than before.,55,2020-03-21T22:37:33Z,UgypQBENtULsj1LcJO14AaABAg
@PhilipJFry-qh2jg,"In Dec 2019, the Chinese authorities notified the world...",71,2020-03-21T22:25:49Z,UgwN5athEc6EDmqtOa94AaABAg
@claymore609,"006 no china did not warn the world, a lowly Doctor did, and he died for doing his job.",8,2020-03-21T22:19:06Z,Ugwk3YBqRV0vBYYgUCd4AaABAg
@stephenmagee2016,This is going to be taught in history lessons.,200,2020-03-21T22:09:35Z,UgyePNtGe9GtQ2dnZbN4AaABAg
@lordemirhan8087, ENG  Thanks to All Translators for Fast Subtitling,28,2020-03-21T21:58:40Z,UgzmwyRbedCMPM_0gMx4AaABAg
@phnxmusicnz,Everyone in the world should watch this video,1386,2020-03-21T21:53:20Z,UgwPoRRbC13vRjz36kV4AaABAg
@philycheezesteak5176,"Wash your hands like youve just cut up some jalapenos, and want to put in your contacts next. Best advice ever.",2651,2020-03-21T21:49:25Z,UgzCj7gMMbJGuNuIQD54AaABAg
@seanhamel3551,"I am loving this social distancing, Im quite the introvert and love my alone time  Maybe this will change some peoples minds about spending time with themselves.",6,2020-03-21T21:40:17Z,UgwII0i6jaz12A4-Hut4AaABAg
@klee8272,and here we are w gen Z boys n girls fighting for their socalled freedom out of the quarantine,23,2020-03-21T21:33:03Z,UgxnxiX6qJ7D2FXKuSJ4AaABAg
@zbynekptacek9261,"Many topics for the follow up videos as well  mental health in isolation, economical effects of pandemics, will the possible vaccination for the next year wave be enough?,  Politics and Pandemics, obligatory respiratorsfilters explained ... and many more.",7,2020-03-21T21:31:10Z,UgxZTzpy5jR18pAABBp4AaABAg
@erenyeager-jr2ch,"If it starts with fast spread, its going to end terrible",99,2020-03-21T21:20:18Z,UgwdIo_j3S3AvK2iJzB4AaABAg
@brauliosedano3007,"Wow, Ive seen like a million coronavirus videos and this is definitely the best one. Short and with lots of imagery, just perfect.",38,2020-03-21T21:06:31Z,UgwmWEI8CsBqmJc3amx4AaABAg
@Fl0yd-,it gets infected and begins to yell bloody murder,1198,2020-03-21T20:06:00Z,UgyIqYYuwa_xqZrtzHB4AaABAg
@dotdotdotdotdotdotdottod,what happens when it infects someone and what should you do,26,2020-03-21T19:32:21Z,UgzrBlP7bhJAmjAIPap4AaABAg
@cowtaplayz8277,"EVERYONE When you get home wash your hands immediately, so you dont spread it to anything in your house.",920,2020-03-21T19:23:09Z,Ugw_fO5S1Tsx7Ae6Flp4AaABAg
@flynny499,I feel like im getting corona virus just watching this.,6,2020-03-21T19:20:11Z,UgxbOTabrDbokOx6Fz54AaABAg
@PneutaticDragonStudiosLLC,"Explained so well, even a 1st grader would understand.... Thank you!!",7,2020-03-21T19:09:51Z,Ugz7kLOQwjPHdQ74ClN4AaABAg
@TheHelghast1138,I learned more from this than I did from my own government,16,2020-03-21T19:08:02Z,Ugz29bokG5c7uIkDx_54AaABAg
@yopassthebarbecuesauceform7677,Me at the hospital Mom...i think have the Corona...,15,2020-03-21T19:01:28Z,Ugx6Hjx2JzxaZQTH93N4AaABAg
@Dev84376,When is Kurzgesagt is gonna do a team reveal? I always wondered what does every person in the team look like!,60,2020-03-21T18:53:00Z,UgwqsyDBOQUl83FvOtd4AaABAg
@sidapostol,"The part where he said you depend on them, and they depend on you to not get sick hits very hard. This must be understood by many, especially kids these days.",10,2020-03-21T17:23:47Z,Ugyunxo0NAgjl7NLBkx4AaABAg
@nacanfriends4840,Can we take a moment and admire how much crunch time was needed to make this video possible?,7,2020-03-21T17:12:29Z,UgyUW12dgtajodW1vTt4AaABAg
@Physico,Gamers  Ive been training for this moment my whole life..,237,2020-03-21T17:03:50Z,Ugz8_6dcJGs7UXftzEJ4AaABAg
@swifttaylor8659,People in the future are gonna be like WhOs HeRe AfTeR tHe ViRuS?,4337,2020-03-21T16:40:01Z,UgxjcPHDv7QiyU27uFd4AaABAg
@Dadc0rd,Hand sanitizer 1 drop Kills 99.9 of germs,166,2020-03-21T16:36:12Z,UgxcMD1MFSeVnF_PHS14AaABAg
@user-ns2uw9zl3s,This video should be everywhere from mainstream media to schools etc.,77,2020-03-21T16:23:32Z,UgzGpE2IpfyHPVgyvfx4AaABAg
@jonathanmontoyabedoya3949,This is icredibly well xplained.,179,2020-03-21T16:05:26Z,Ugwvy5Im73g0QZfx-hJ4AaABAg
@4yeSpazz,Imagine being the first person that had it knowing that you just spread a virus pandemic across the world  like who tf was patient zero,44,2020-03-21T16:02:52Z,UgwVQaNDdelS7ZLgyNF4AaABAg
@enam9000,This should be an advert everywhere and have billions of views!!!!!!,228,2020-03-21T15:37:13Z,UgxKBurC45gOZsMk6F94AaABAg
@ActivBowser9177,"Doctors If you get Coronavirus, stay at home so that you do not infect others.",412,2020-03-21T15:28:34Z,Ugx5l1dXFqcMoI-_D4l4AaABAg
@hantuzun,This video was so good that it must be translated to different languages. Could you possibly share a raw version so that the texts and the voiceover could be translated?,6,2020-03-21T15:14:53Z,UgyUVYWiMkOdVkReSUJ4AaABAg
@adankerr,This really was useful since it puts it into terms that most people actually understand. Thank you!,6,2020-03-21T14:38:23Z,UgyH0BWthtkgUYThK6Z4AaABAg
@jeromecodes2111,"I live in the US, were screwed here",26,2020-03-21T14:37:02Z,Ugyn4rsswrgkCTc9t0l4AaABAg
@MsAnzoe,Social distancing  which is not a nice experience but a nice thing to do  jup.,177,2020-03-21T14:05:52Z,UgxW0XgHMlxPf4U8ryl4AaABAg
@sherib5752,832 Gimme that toilet paper!!,9,2020-03-21T13:55:26Z,Ugxz-vuhoe9H_0g3ZG54AaABAg
@Fplfplfpl,"This virus just makes me think that in  case of a zombie apocalypse, we would all be dead before we can do anything",78,2020-03-21T13:34:23Z,UgzV0Tu0EKutrgeVjrZ4AaABAg
@xyckriz,voice actor 225 cells have neither ears nor eyes,46,2020-03-21T13:11:46Z,UgyZWmUhQDfB7Sky4fN4AaABAg
@censored9889,"027, anyone else notice the toilet roll held by the monkey?",65,2020-03-21T13:03:42Z,UgzOkJMt_nWQH4TTnZp4AaABAg
@bubblegumpurple7525,None of this is fun,532,2020-03-21T13:02:59Z,Ugy9u0WkomukC9L_yDp4AaABAg
@MarceloB,what i learned with this video,26,2020-03-21T12:48:20Z,UgxdctY5zVCLtfS7Qhl4AaABAg
@limedwire2187,"As someone who works in health care, this social distancing is to prevent NIGHTMARES at hospitals..",1958,2020-03-21T12:42:11Z,UgzLz5-syxeCZEREotF4AaABAg
@bnanney11,China alerted the world,199,2020-03-21T12:41:30Z,Ugxvn4dG2T9U4TDnfpB4AaABAg
@friun.6824,025 so thats why those toilet papers ran out...,46,2020-03-21T12:27:35Z,UgxYg3jjxVBpQeKkeC94AaABAg
@triny89,"I guess ,in present situation,  there would be a drastic increase in number of Netflix accounts ",13,2020-03-21T12:15:28Z,Ugxk3Ap5a7y7h_2owmZ4AaABAg
@MarouaneTF,You know something is serious when kurzgesagt talks about it,174,2020-03-21T12:06:55Z,Ugzo0npSYOgMskmnb454AaABAg
