Author,Comment,Likes,Published At,Comment ID
@62crowsinananunusuallyshin97,"corona causes the cells to overreact, and yell bloody murder. So just like the beer then, I knew it!",13,2020-03-20T11:00:02Z,Ugz4SkjTZQ5bVIUFuSl4AaABAg
@joneilism,"POOR self harming cells! Ive set up a counseling appointment for them with a therapist called, Mrs. VACCINE!  Just have to trust her and all the research shes done when she finally gets here. ",6,2020-03-20T10:59:14Z,UgzDseK3u3VOiiXZ3pp4AaABAg
@Operational117,"Governments Stay away from crowded areas. Wash your hands vigorously, and often. If you can, stay indoors.",22,2020-03-20T10:57:36Z,UgwVEPSaAWLearnhaUZ4AaABAg
@ArjunThatai,And UK is developing herd immunity which will lead to 1 million deaths.,34,2020-03-20T10:57:02Z,Ugwyq86TtQc-704jaol4AaABAg
@Murka1o,whoever animated this needs a raise lol,22,2020-03-20T10:56:23Z,Ugw9hjuUgnhXlJ57yu54AaABAg
@really-shouldnt-be-here,Thank you so much for this! People need to stop panicking and be more resourceful and prudent as to not spread the infection. We need to realize that ALL of us are involved and it takes a collective effort and small individual sacrifices.,16,2020-03-20T10:48:33Z,Ugw_SlZ05GDHA_ChtZF4AaABAg
@sieghart6412,"The toilet paper at the end, lmao.",108,2020-03-20T10:44:30Z,Ugz64gRuU-RZEuLie194AaABAg
@Lyonlionify,Everybody is Kung Flu fighting,10,2020-03-20T10:43:16Z,Ugxl9Pmgqz_JsFGgDnV4AaABAg
@jlbautista2370,soap is a powerful tool!,18,2020-03-20T10:41:17Z,UgwX2TNB0uL_gkAxEpZ4AaABAg
@bradpaii,None of this is fun,15,2020-03-20T10:40:54Z,UgxFquTUoJpQdYFdrrJ4AaABAg
@mikaelfalk6720,No One will remember a slow pandemic,13,2020-03-20T10:40:07Z,UgxaB2ij_VAZMbViyUJ4AaABAg
@amanseervi5629,If this happens horrible decisions will have to be made on who gets to live and who dosent,140,2020-03-20T10:38:41Z,Ugyh8Ko2GIWS7oRQfRJ4AaABAg
@Sumirevins,So the best thing is to social distances,11,2020-03-20T10:36:14Z,UgzMJEuHMCKCS-_hQg54AaABAg
@sciencetanium3216,"All the thing, I can say about media, person and organizationbs like you who are constantly making people conscious with these facts and also those who are constantly working, like doctors e.t.c. to save us from this pandemic.",48,2020-03-20T10:35:22Z,UgwSgzMMWM9gq-C2uHl4AaABAg
@fushiro1589,555 WAS THAT A JOJO REFERENCE!!!!,13,2020-03-20T10:34:05Z,UgxqnQWt-VmwkKA4LR54AaABAg
@louisuchihatm2556,"Kurz 330  In many cases, the immune system slowly regains control.",20,2020-03-20T10:29:25Z,Ugw9mFBcbxLm6IuiJyF4AaABAg
@phamquanghuy2222,723 Quarantines are not great to experience and certainly not popular,49,2020-03-20T10:25:22Z,UgwjyzNew4vahC7-86Z4AaABAg
@iconic6033,Wow there are some people who press the dont like button,857,2020-03-20T10:24:21Z,Ugz9bbTJI0yXvYZQMLx4AaABAg
@jessehernandez424,"First of, China tired to cover it up. Did not try to inform the world right away.",13,2020-03-20T10:23:22Z,UgzdoBGF_EZ6IW7HlKd4AaABAg
@treeway5474,"Im for 45 days in Quarantine, thats not Funny....",26,2020-03-20T10:18:31Z,UgzqF6xMUIU7-ogFyRB4AaABAg
@RandomPerson-zx7zb,028 That toilet roll just travelled back in time to avoid the coronavirus,36,2020-03-20T10:17:47Z,UgxXB0EHegeg6XKpBJp4AaABAg
@chronikhiles,Social distancing is not a nice experience.,142,2020-03-20T10:17:12Z,UgxH05Nw8kS3WcmSDFZ4AaABAg
@purpleblue6471,Im in quarantine and I cant see my loved once because of it and it makes me really sad,18,2020-03-20T10:15:56Z,Ugx-lrWEeNF92FYLthJ4AaABAg
@Kneirros,I actually understood coronavirus more when Kurzgesagt  In a Nutshell released this video rather than when I was just reading or watching stuffs about it  thank you Kurzgesagt!,22,2020-03-20T10:15:23Z,Ugx8m7qPWG3rgNKV31d4AaABAg
@JoeTheGreat08,Too the idiots on YouTube that keep saying its basically the flu.. watch this video,15,2020-03-20T10:12:46Z,UgwP9grEWzpzbPzZ9zx4AaABAg
@centauria9122,Government We highly recommend you to stay inside your homes!,31,2020-03-20T10:11:43Z,UgyG0OH-vL9cinSutk54AaABAg
@IrishBelmont,"Its safe to say that COVID19 will be remembered by the history books, mostly because of its fast spread, the plunge in the market and the sudden halt in businesses.",162,2020-03-20T10:11:37Z,UgxOj2oMU0EOHtdDaJ54AaABAg
@videoswithsubscribers-xk5hb,The first week of quarantine is actually quite fun..,6,2020-03-20T10:11:31Z,UgzqssbDH3URLELQwCd4AaABAg
@zragon3721,When soap is the most powerful tool to defeat corona,20,2020-03-20T10:10:56Z,UgwVtPZWJ3ynp0AJUjp4AaABAg
@Ghoffman91,Coronavirus Your people dont have a chance.,74,2020-03-20T10:08:34Z,UgyYJz6BrUC7BJN8en14AaABAg
@brandonthegrey,Ive been training for this my whole life,14,2020-03-20T10:07:53Z,Ugxd8CRRDlnJUcg6AXJ4AaABAg
@gad8150,When your lifestyle is considered social distancing lol,46,2020-03-20T10:07:23Z,UgzTtZThvAipV9rVPMB4AaABAg
@luigidisanpietro3720,Thank you for being sensible and saying that the COVID19 is worse than the flu....,19,2020-03-20T10:06:50Z,Ugzgenpl1Cty-5LXmzp4AaABAg
@prestige_123,Immune system idk who to attack anymore!,319,2020-03-20T10:02:56Z,UgxsRFeg5K85Esl-rK94AaABAg
@commanderboreal1343,Hey UK youve seen this new video abou..,27,2020-03-20T10:02:17Z,Ugwqqv6jP1mTpO3i0Yp4AaABAg
@hugovallarta,"As informed as most humans on this planet believe they are, this is the clearest information package in the world at this moment. This will save lives Kurzgesagt, Ive said it before and say it again what you do matters and we thank you",220,2020-03-20T10:01:47Z,UgxyP4wugjNWjsMLx_l4AaABAg
@catbug4889,"Kurzgesagt avoid touching, hugging others, social distancing and be hygienic",193,2020-03-20T10:01:35Z,UgyWjzmE-V_FQ0obZLR4AaABAg
@ianalvord3903,All this fearmongering is going to cost me my job and my livelihood. Its honestly doing more damage than the virus.,12,2020-03-20T10:00:47Z,UgxGeNwKgOeX9SKMSuF4AaABAg
@DiRtYLaWs2007,"Meanwhile in the UK people are panic buying like its Christmas Eve, spreading the virus around the supermarkets.",1757,2020-03-20T09:59:46Z,UgyWma0lBa15RawrPZN4AaABAg
@ZackTanTYZ,When it reached the point where Plague inc jokes were not funny anymore.,35,2020-03-20T09:59:00Z,Ugy0W9g1rdkIOaAX0S54AaABAg
@thenasiudk1337,When Covid19 start to infect the immune cells,16,2020-03-20T09:58:35Z,Ugz7ImYNAl0ToM3nX1N4AaABAg
@athendity2567,Man... I wish we had Therapist cells that could talk the cells out from selfharm,652,2020-03-20T09:58:34Z,UgzVkZyvP26hAlZ3WqV4AaABAg
@jrlopez1027.,_When you feel a cough and have the sudden urge to travel to seven different countries_,13,2020-03-20T09:54:43Z,UgyRGY_5fE1vnz4M42V4AaABAg
@pisikesidnei,When your immune system starts attacking your body,196,2020-03-20T09:52:11Z,Ugw8Nh3mpsF1FjDiRJB4AaABAg
@Bahiti-wv7yh,Thanos I used the stones to destroy the stones,622,2020-03-20T09:51:40Z,UgzK4J77uZilm7ybfiJ4AaABAg
@kurokazuki6288,None of this is fun,253,2020-03-20T09:47:29Z,UgxTgO8xcwYiip0TH-B4AaABAg
@HansLemurson,028 That chimp is hoarding toilet paper!,382,2020-03-20T09:40:27Z,Ugx708oIHAzSLPgEkt94AaABAg
@yofriendfromupnorth5741,"In December 2019, the Chinese authorities tried to cover up a new rapidly spreading virus until they couldnt, and let it spread to other countries before finally taking action. There. I fixed the intro.",9,2020-03-20T09:40:26Z,UgylF1fWOBjgPsh0zbh4AaABAg
@vivanillah07,Extroverts You cant make me an introvert,35,2020-03-20T09:39:10Z,UgwSVSzpt1xun9biqxx4AaABAg
@20quid,"The next thing is social distancing, which is not a nice experience",30,2020-03-20T09:38:42Z,UgwC2fzevz9qnJ9-A7J4AaABAg
@simulify8726,Kurzgesagt has one of the most detailed yet simplistic animations I have ever watched in my life. They are Buttery Smooth.,1191,2020-03-20T09:20:21Z,Ugw5qh4fCBJAby11Atd4AaABAg
@danterik9781,I remember them saying it takes months to make a video and then i see a title for something fresh in the world.,430,2020-03-20T08:10:19Z,UgzpisKdhetcUN-IUyJ4AaABAg
@marianokal8767,Minor error. As you show the epithelial lining in the lungs it has several layers when in fact it should only have one.  Loved the video tho,7,2020-03-20T08:07:09Z,UgzOzpP1IGhbSbrS7cd4AaABAg
@user-fh5ov4tu2j,This makes me anxious and calm at the same time,24,2020-03-20T08:05:01Z,UgwB_djDl5gKGSIMKn94AaABAg
@sabersroommate8293,Remember to share this to people who say Its just a flu bro,20,2020-03-20T08:03:21Z,Ugy5wwawVNvoTI6R56B4AaABAg
@Lol-zo8qx,God What can you do other than infecting people,74,2020-03-20T08:03:00Z,UgylF0y60aRa6bCzVFN4AaABAg
@dead2675,What do we call when corona virus gets spread to Britain?,208,2020-03-20T07:59:02Z,UgwLvoXTm6lQWR4Klld4AaABAg
@TheMasterChiefODST,"I study biology in Mxico, at the UAM, and I can asure that Kurzgesagt is one of the few YouTube channels that really worth it.",56,2020-03-20T07:49:16Z,UgxpKxtflERHMMH4JWR4AaABAg
@cloudgazer4570,The Chinese authorities notified the world.,6,2020-03-20T07:00:05Z,UgwVi62OsrygQNKGu-x4AaABAg
@SCRKT007,Soap is a poweful tool,172,2020-03-20T06:15:48Z,UgxGNBKkprdjEsJivOF4AaABAg
@rachelclare5483,"The can we go bed now made me remember how it takes you guys 3 months to make your excellent, self aware and balanced content. We ALL really appreciate the effort and careful accuracy it takes to make a video like this. Im sharing!",120,2020-03-20T05:32:37Z,UgzJstZTZ9sJOfx_Sqp4AaABAg
@IanGrams,"To everyone who makes Kurzgesagt possible, from the bottom of my heart, thank you so very much  I genuinely believe you all make our world a better place. Ill be making a point to share this video everywhere I can and finally ordered some merch to put my money where my mouth is ",1740,2020-03-20T05:21:05Z,UgwnlWrtqOTAf1QrLc14AaABAg
@kathleenw1475,Tf YouTubes so weird like they want people to know more about COVID19 yet they softbanned this extremely informative and interesting video??,215,2020-03-20T05:18:10Z,UgxRv1pSMcdt6T1avb14AaABAg
@retro5624,A slow pandemic will not be remembered by the history book.,841,2020-03-20T05:13:18Z,Ugxxuyl6sTogE3xm1iF4AaABAg
@astro.,Great video. Kind of wish you addressed the artificial demand caused by hoarding of things such as toilet paper and hand sanitizer as well. People need to chill,7,2020-03-20T05:10:37Z,UgwZBHzxz53BThxFmOt4AaABAg
@prakratidwivedi367,Corona Virus  Your nothing in front of me.,31,2020-03-20T05:07:26Z,UgzfX4ogAXL3D5pst_l4AaABAg
@animevsirl,Measures for Social Distancing Try to stay at home,72,2020-03-20T04:52:42Z,UgwbtbZKYsFxJHuC8u94AaABAg
@satendrsingh9712,People scared of the virus,34,2020-03-20T04:23:18Z,Ugzz489b_C1XSKYuyXp4AaABAg
@weezyweez2427,You forgot to mention the Travel symptom where infected individuals receive sudden urges to enter contained and highly crowded metal tubes headed to adjacent urban areas.,41,2020-03-20T04:01:49Z,Ugy1gZY2nWH-YfYtnE54AaABAg
@ruvi2864,Corona virus at job interveiw,9,2020-03-20T03:57:46Z,UgxYosKBPk0eZBoBoEV4AaABAg
@sakatakintoki597,When your immune system starts attacking your body,2127,2020-03-20T03:51:53Z,UgybpkI8hmMckLZ6sdd4AaABAg
@mrtheman548,I just wanted to say thank you to the fact that this single 8 and a half minute video has been more informative about this virus than the entire fiasco of fear and panic as portrayed by the Mainstream Media,490,2020-03-20T03:46:52Z,UgxptV9oqo1xUPKYJz94AaABAg
@jadez3681,Im a pharmacist and this video is a really good way to educate our patients about Covid as it is short and easy to understand. So thank you kurzgesagt!,308,2020-03-20T03:45:42Z,UgxWxgFHXsftZTptGUp4AaABAg
@KampersandH,"You guys managed to inform us with correct information correctly, and also made the video appealing and convincing. You guys literally worked day and night, and did an awesome job! Also, congrats on 1 on trending!",199,2020-03-20T03:37:07Z,UgyXEnYi3r0ElwGQ-u14AaABAg
@nohaxjustxmod-sfs3984,"Coronavirus and bacteria Alright, lets do this!",12,2020-03-20T03:02:32Z,UgxtxgDs06PBHxEFTTV4AaABAg
@myopyaesone1062,"Youtube softbanning this video? I saw this being shared on twitter, not from noti or subscription list",11,2020-03-20T02:41:11Z,UgyfeX4hzL_DnxTXC2t4AaABAg
@Unknownsoldier740,I couldnt see this video in my sub feed. Luckily I rang the bell. Youtube needs to stop messing with the sub feed. This is ridiculous.,19,2020-03-20T02:39:43Z,Ugz3un1OpaSNpKmKOiR4AaABAg
@CJusticeHappen21,"Okay, humans. Hunker down and enjoy some solitude.",50,2020-03-20T02:37:52Z,UgyFzdpodta4Q02n4kN4AaABAg
@drlauch2256,Lets get this TRENDING!,23,2020-03-20T00:53:50Z,Ugz82-8Q0J5RGKHMoRh4AaABAg
@DragonKingZero,"245  So, CoV2 is basically a random encounter monster that can wipe out a party just by spamming Confusion and Berserk inflicting moves?",23,2020-03-20T00:49:38Z,Ugxs3nB718F22W32qi14AaABAg
@Lloyd_Montecillo,"Now, this is good delivery of advisory against the pandemic. There are too many media outlets that either downplays or exaggerates the danger of COVID19, as well as the typical doomsayers that induce panic among the civilian populace.",40,2020-03-20T00:40:02Z,UgwKAxMWnvr17aejPgp4AaABAg
@deep.space.12,"050 Hence surgical masks are useful, despite the misinformation that viruses are too small for the filters, because the main carrier is droplets, not bare virus particles.",6,2020-03-20T00:21:38Z,UgxoM3Bd3qeM0CGERUF4AaABAg
@guilhermehenrique3830,Is it just for me or YT is trying to not show this video to me when i search?,9,2020-03-20T00:21:27Z,UgyVUGIUofZHJZvEHfh4AaABAg
@NurchinsCryptids,Im constantly impressed by their ability to report on events full of polarizing actions and decisions without villianising anyone. Incredible as always,11,2020-03-20T00:19:33Z,UgxS7xr91u8wxKSQ06p4AaABAg
@deep.space.12,Introverts are gonna win this round of natural selection...,19,2020-03-20T00:19:25Z,UgxJE24abOD__DsvE9p4AaABAg
@An0ny,Imagine seeing you grand kids studying about the corona virus in history..,255,2020-03-20T00:18:02Z,Ugyx3p3LyarBTOTg4EZ4AaABAg
@danirabinowitz5049,Video request Celiac disease in a nutshell! That would be super interesting and not well covered in the way you guys explain things!,12,2020-03-20T00:00:16Z,Ugy6U245ujIUj7XModV4AaABAg
@Killer_Turnip,"Theres so much confusion and panic out there, contributing to misinformation...thank you for making this easytofollow video and to all those who helped.",232,2020-03-19T23:53:12Z,Ugx-X_A3qkb--TV3iMF4AaABAg
@JNSStudios,This video isnt showing up in my sub list or searches. Did you guys get demonetized for talking about the Coronavirus?,15,2020-03-19T23:45:30Z,UgwPB6w4GcUccOxUkPp4AaABAg
@Dillon-117,"This was literally not in my subscription list. Somehow, its trending, but still not showing up for everyone.",15,2020-03-19T23:43:23Z,Ugw_H5up4Php7EI3KuZ4AaABAg
@lailamansour9100,Corona kills thousands of people,16,2020-03-19T23:38:12Z,UgyioUWBGAndbgKd3fp4AaABAg
@anaxiblue5240,"This is my generations first worldwide crisis, and the solution involves us staying at home by ourselves for a very long time. Its as though weve been training our whole lives for this. Turns out God has a sense of humour after all.",22,2020-03-19T23:35:01Z,UgyuX46spYtj1r8SuSN4AaABAg
@RedPilgrim.,"Its weird, Ive subscribed to the channel but it doesnt appear in the subscription playlist at all. Im only aware when someone shared on FB. ",8,2020-03-19T23:28:35Z,UgzvD7r8gml-NxqsEuJ4AaABAg
@jednewman430,"For some reason this video didnt end up in my sub box, the only reason I knew it was up was because I saw the sound track on epic mountains channel",52,2020-03-19T22:42:17Z,UgxTNnSOOPvRMufS4St4AaABAg
@brogcooper25,Literally and figuratively.,426,2020-03-19T22:41:44Z,UgxLz5u2VwujEwq_MV14AaABAg
@lightsamus,"FYI  I cant see this video in my Subscription tab on my phone. I had to search for your channel and open it directly, only then could I see the video.",33,2020-03-19T22:33:53Z,UgxRrLwGiJM81mgyPGh4AaABAg
@esedege4918,"I was notified of this video, and it appeared as normal in my subscriptions list but then suddenly dissappeared and its only reachable directly going to Kurtzgesagt channel  Videos. It does not even appear when searching Kurtzgesagt coronavirus. I even thought you guys had taken it down.",30,2020-03-19T22:31:21Z,UgxBadoOwrl8lvnriVJ4AaABAg
@OverlordZephyros,Introvert like myself have no problems with staying at home and social distancing lol,12,2020-03-19T22:29:12Z,Ugx2rcS13Z-PF9kiCHh4AaABAg
@leonprowse5806,"If they start slow, with a not so steep slope, they end okayish.  Love the honesty.",593,2020-03-19T22:20:31Z,UgzJ4RcqZQVKcIz4YMN4AaABAg
@konichiyawa5087,Ignorant cell How many photocopy you want of yourself?,35,2020-03-19T22:07:39Z,Ugw3V5aK7y6RdvKHKlN4AaABAg
@jerry3790,"Incredible how you were able to manage such a time sensitive topic, while still maintaining the usual quality standards",713,2020-03-19T22:00:19Z,UgyQzEqXvotT-NHiweV4AaABAg
@ASLUHLUHCE,When you realise your normal daily lifestyle is called quarantine...,49,2020-03-19T21:56:19Z,UgyNLmlQvkEC04ligdJ4AaABAg
@ninja650rn,"Why didnt this show up in my subscription list? I had a friend send it to me, otherwise I wouldnt have found it",27,2020-03-19T21:47:18Z,UgysOu8foRzQnz9I2Ih4AaABAg
@arturo435,Wash your hands like you just touched some jalapeos and wanna put your contacts,23,2020-03-19T21:30:30Z,UgyBs4ZKjFmKAAB7Cdx4AaABAg
@azatecas,why did youtube not show this in my subscription?,9,2020-03-19T21:25:39Z,UgxO1gCdHQWa3y38PgJ4AaABAg
@TheAmazingCowpig,Wash your hands as if youve just cut up some jalapenos and want to put in your contacts next.,12363,2020-03-19T21:23:39Z,Ugy47gVSKkkvDA3sj214AaABAg
@manvslife271,"The video is removed from my subscription box, and its prob demonetised aswell because it mentions the name of the virus. Thanks shitty youtube algorithm.",7,2020-03-19T21:10:51Z,UgzSy2coNhe2OEwl9QB4AaABAg
@robertmontgomery7158,"noted earlier, according to a detailed insider account published by the China Media Project, on Dec. 30 the Wuhan Health Commission issued an order to hospitals, clinics and other healthcare units strictly prohibiting the release of any information about treatment of this new disease.",15,2020-03-19T20:47:51Z,UgykEzuUYZhgM_YplBt4AaABAg
@krombopulosliam9736,"This video was in my subscription feed earlier, then later when I checked again it was gone. I thought it had been taken down until I checked the channel page.",18,2020-03-19T20:35:02Z,UgwbwfEg41iZvGUcAut4AaABAg
@AmunRa1,WHO Please stay home and isolate yourselves.,111,2020-03-19T20:33:36Z,Ugw9T90xVbfUk83erV94AaABAg
@aarongariepy2539,China informed the rest of the world...,6,2020-03-19T20:33:12Z,UgxQmaK-sGYCdLSmrEl4AaABAg
@Chahta,I love that you think about details. You said If they start slow....they end okayish 754. You used okayish. Nice choice of words. Some very clever people are writing scripts there.,11,2020-03-19T20:31:42Z,UgyiSfO9WOjkBQrbcOp4AaABAg
@l.a.pp.5454,028 An ape with toilet paper,14,2020-03-19T20:29:23Z,UgxAfrbvVPHfcWP44B54AaABAg
@justcare.9390,Me 2020 is my time to socialize more!,307,2020-03-19T20:27:31Z,Ugy0P-yyEe390yEUXKN4AaABAg
@MJTH,"Its depressing that videos on this topic are disappearing from peoples subscription feeds. I get that they are trying to stem the tide of disinformation, but I cant find reference to this video in my subs even though I knew it existed. Keep up the good work.",9,2020-03-19T20:25:28Z,UgxUH5oqaNc1t1V34c94AaABAg
@DragonfireVEVO,Finally propper explanation for the public.,6,2020-03-19T20:23:12Z,Ugy3klIYubop54Ja4lB4AaABAg
@DurvalLacerda,I recommend the anime Cells at Work!,15,2020-03-19T20:23:09Z,UgzEWT38FfrAUtIsHIN4AaABAg
@impolphin3337,Its a shame they all died like this    But look at how clean there asses are,429,2020-03-19T20:19:09Z,Ugy9OuvSPMHk6uPBAv54AaABAg
@AIex_Kidd,"Bergamo, Italy, here.",386,2020-03-19T20:17:40Z,Ugyfk12RsY4KcLBBvFd4AaABAg
,We need to translate this in as many languages as possible.,2641,2020-03-19T20:12:43Z,UgzaixI-hrkP_RlTqqJ4AaABAg
@zacharyparis,Plot twist 25 million people in the US dont have health insurance and cant afford to see a doctor anyway.,17,2020-03-19T20:10:36Z,Ugwd6wzcnlOO3O16zgd4AaABAg
@berryfairy68,"This is the type of explanation I enjoy, not the media spreading nonsense.",85,2020-03-19T20:09:51Z,UgxshlpFjanHn1mrjp94AaABAg
@OneBitGaming,Immune system confused by corona virus and pissed off.,12,2020-03-19T20:07:52Z,UgypNoKB8wQXRz2EG1p4AaABAg
@shakeromania4100,What You Should Do,9,2020-03-19T20:05:49Z,UgwiMZyAIXzugQxIDNx4AaABAg
@mist_mip480,Meanwhile in my family...,21,2020-03-19T20:03:38Z,Ugwp7draey3iQ94BKiJ4AaABAg
@RayJLau1,Hello everyone across the internet! Much love to anyone who is reading this. Times are scary. We can get through it if we work together. Be kind to each other. We can do this!,25,2020-03-19T20:01:44Z,Ugzk07o_TdXQYq8Zp0x4AaABAg
@bugjams,739 My house got quarantined recently.,88,2020-03-19T20:01:26Z,UgxEov1P7AQD5Xd_k4J4AaABAg
@ezyt447,"I love it when Kurzgesagt animate, its much more entertaining and it makes me more interested in a topic. Thats why Ive been waiting for this. You have changed my life alot Kurzgesagt.",141,2020-03-19T20:01:22Z,Ugws8-OXgTBxgtZlOzt4AaABAg
@tomatoian9031,"doctors we stayed at our work for you, now you stay at home for us",156,2020-03-19T19:59:28Z,Ugyeqt1iJBTsGfLczg54AaABAg
@AIXITstageleft,Me Hopefully god looses plague inc.,11,2020-03-19T19:57:37Z,UgwSMMadasI_If_iRe94AaABAg
@mehmetasma8719,"When seen this way, its much more terrifying.",11,2020-03-19T19:56:12Z,UgzR-7WLXZMp6mjtlVZ4AaABAg
@tomatoian9031,"coronavirus the pandemic that made people realize the power of washing hands, and when shtty health systems were exposed",361,2020-03-19T19:54:35Z,UgyOfJAzEj-nJBcAvAl4AaABAg
@iamankitsaxena,I will do my part In Making it a Slow Pandemic.,32,2020-03-19T19:53:12Z,UgyIyHc56VfSZ8diLwV4AaABAg
@samo260293,"Here  in Mexico we are not in national quarintine yet but the people are already staying at home and the schools are already closed just with only 118 cases, and Im very proud about that",53,2020-03-19T19:52:53Z,Ugz5ixs8ahnBHMAX_wF4AaABAg
@tomatoian9031,"imagine kids in the future learning about the coronovirus, that became a pandemic, as a part of their history class. lol",36,2020-03-19T19:51:51Z,UgwkSgkXgUTc7z973z94AaABAg
@HasanK00,"I think its cool how some of the birds had bags under their eyes, just goes to show how much time and effort they put in to get this video out as quickly as possible to inform us. You guys definitely deserve a break lol, thanks for looking out for us.",838,2020-03-19T19:51:34Z,UgxMIlp2SUkw8l-9IL94AaABAg
@zgdestinyy,"Im italian and obviosly all of Italy Is under quarantine, see you After the quarantine lol",6,2020-03-19T19:51:25Z,UgzEh-B9JIH0lN0s99x4AaABAg
@noahr.7144,"GUYS GUYS can we apreciate how fast they got this video out? Like holy cow, theres no way that they started this a reasonable time ago being how fast everything started up getting bad.",301,2020-03-19T19:49:06Z,UgxyZHramlgsvRXrgMt4AaABAg
@SolvedEnglish,"I love the last expression used At the end, its all in our hands, literally and figuratively ",1110,2020-03-19T19:47:29Z,Ugzxa9qWGy7hqbUXpW54AaABAg
@christopherg2347,"436 So Corvid 19 is like the love child of Measels, a Alergic Reaction, the flu and a suicide bomber.",21,2020-03-19T19:45:19Z,UgybRj9wIKCYAYvsVml4AaABAg
@tenkovito,Video describes symptoms and how it affects your lungs,128,2020-03-19T19:43:22Z,UgyV4U8vk2YmJG3iQO14AaABAg
@user-fx9ct3yz9h,Me yes! this is the video Ive been waiting for! Kurzgesagt will explain why I shouldnt worry and convince me that the virus is not as dangerous as it may seem because of the panic.,13,2020-03-19T19:43:15Z,UgynicpYalwdDqTFkoV4AaABAg
@friend6281,"Dont forget to smile at the humorous things in life. Maybe laugh a little, too. Whoever you are, wherever you are, I wish you the very best.",138,2020-03-19T19:41:36Z,UgyLT0RaKN48rXzpS554AaABAg
@RGBY-tv4hg,Immune system Destroys healthy cells,364,2020-03-19T19:41:01Z,UgyPNeW9UmsgwqD6SYF4AaABAg
@taicheng243,WHO Wash. Your. Hands.,10,2020-03-19T19:40:47Z,Ugz9gKbAETC6Zv_n7dB4AaABAg
@thetruffleshuffle21,China also lied about all this and tried to cover it up! They delayed telling internationaly which lead to it being worse,11,2020-03-19T19:39:59Z,UgyJ5bvszFpKDXH8g-d4AaABAg
@maxchen6525,China and Italy quarantines whole countries and cities,43,2020-03-19T19:39:33Z,Ugz6yGErhkkZOzKLktp4AaABAg
@multienergy3684,"I live in the most affected city for Coronavirus in Italy, in the old part.",93,2020-03-19T19:34:56Z,UgwdIAB2OyVDGfXyKC14AaABAg
@harryli5979,649 bro I wash my hands for 3 minutes after cutting pepper but when I put in my contacts It still burns,14,2020-03-19T19:32:15Z,UgwCNXlv2WZdzAmTO094AaABAg
@santoshbhandari1310,"To whoever is reading this ,",68,2020-03-19T19:31:49Z,UgzszATeVCFpTIb2_tx4AaABAg
@nenko5919,"This video deserve  I mean, have to  be shared the most, so people wich was reluctant with the quarantine will maybe start to understant the thing happening...",51,2020-03-19T19:31:19Z,UgxoJsXVb38IR2fR-dh4AaABAg
@exleydragon231,Corona virus infects,27,2020-03-19T19:30:11Z,Ugx7d2o2E6X4IZF0lFV4AaABAg
@Kjubb,"Im in a quarantine. I mean, my whole country is. Its making everyones life hell here, at least this video helped me understand it and get me out of boredom for a few minutes. Thanks!",621,2020-03-19T19:28:54Z,Ugw-hypO8FE37-QI-kF4AaABAg
@sonika87,"This is one of the most well selfexplained videos, it should be translated to all languages, congratulations to creators and animators. My respect. Stay safe all",690,2020-03-19T19:25:05Z,Ugwf6v_8cANsOtPMvQl4AaABAg
@Myname-il9vd,"Even though its lower quality as you guys said on Instagram it still manages to be higher quality than the last. Every video is better its insane! Plus this animation reminds me of the old immune system videos, I love it!",8,2020-03-19T19:24:57Z,Ugx1qHJBqlVtT7NunMh4AaABAg
@ZERO_ULTRA,Coronavirus VS The World,238,2020-03-19T19:23:43Z,UgwzeYOjd8rCN0zJQk94AaABAg
@misosoup8,025 that bird is sitting on a gold mine,35,2020-03-19T19:22:53Z,UgyAYFc_K5LxhLxSRG14AaABAg
@DrAgentIce,Coronavirus we gonna ruin these kids spring breaks.,131,2020-03-19T19:22:42Z,UgyLFxyxpgWIVQqY1TJ4AaABAg
